number,value,params_activation,params_batch_size,params_beta,params_beta_warmup_rounds,params_clip_abs,params_dropout,params_first_layer,params_grad_clip,params_latent_dim,params_layer_1_dropoff,params_layer_2_dropoff,params_layer_3_dropoff,params_local_epochs,params_lr,params_n_layers,params_recon_type,params_score_type,params_sgd_momentum,params_sgd_nesterov,params_weight_decay,user_attrs_NF-BoT-IoT-v3__test_auroc,user_attrs_NF-BoT-IoT-v3__val_auroc,user_attrs_NF-CICIDS2018-v3__test_auroc,user_attrs_NF-CICIDS2018-v3__val_auroc,user_attrs_activation,user_attrs_batch_size,user_attrs_beta,user_attrs_beta_warmup_rounds,user_attrs_clip_abs,user_attrs_clip_max,user_attrs_clip_min,user_attrs_dropout,user_attrs_early_stop_patience,user_attrs_epochs_matched,user_attrs_epochs_per_round,user_attrs_first_layer,user_attrs_grad_clip,user_attrs_hidden_dims,user_attrs_hpo_seeds,user_attrs_latent_dim,user_attrs_layer_1_dropoff,user_attrs_layer_2_dropoff,user_attrs_layer_3_dropoff,user_attrs_local_epochs,user_attrs_lr,user_attrs_max_rounds,user_attrs_n_layers,user_attrs_optimizer,user_attrs_recon_type,user_attrs_rounds,user_attrs_score_type,user_attrs_seed_seen_obj_mean,user_attrs_seed_seen_obj_std,user_attrs_seen_test_mean,user_attrs_seen_test_min,user_attrs_sgd_momentum,user_attrs_sgd_nesterov,user_attrs_train__best_metric,user_attrs_train__history_len,user_attrs_unseen__test_auroc,user_attrs_unseen__val_auroc,user_attrs_unseen_test_n,user_attrs_unseen_val_n,user_attrs_weight_decay,state
74,0.8800467737716888,gelu,128,0.4323231624560177,2,8.0,0.010947854044761951,948,2.0,39,0.5201889421955562,0.7574921151152675,,4,0.014249040495519838,3,mse,recon,0.7851937647316861,True,1e-10,,,,,gelu,128,0.4323231624560177,2,8.0,8.0,-8.0,0.010947854044761951,8,483,4,948,2.0,"[948, 493, 373]",,39,0.520042194092827,0.7565922920892495,,4,0.014249040495519838,120,3,sgd,mse,120,recon,,,,,0.7851937647316861,True,,,,,,,1e-10,PRUNED
75,0.8807548133282904,gelu,128,0.36594154375294885,7,8.0,0.0528346101219196,990,2.0,13,0.5685443396366181,0.6270229162939687,,3,0.01281420071255042,3,mse,recon,0.9204586468519602,True,1e-10,,,,,gelu,128,0.36594154375294885,7,8.0,8.0,-8.0,0.0528346101219196,8,362,3,990,2.0,"[990, 562, 352]",,13,0.5676767676767677,0.6263345195729537,,3,0.01281420071255042,120,3,sgd,mse,120,recon,,,,,0.9204586468519602,True,,,,,,,1e-10,PRUNED
76,0.5285386512801986,gelu,128,0.21872856421916612,2,8.0,0.03977347665680395,372,2.0,25,0.5890792734162256,0.7192174035848393,0.999953362424203,4,0.011135029926223663,4,huber,recon,0.8424706727707044,True,1e-10,,,,,gelu,128,0.21872856421916612,2,8.0,8.0,-8.0,0.03977347665680395,8,483,4,372,2.0,"[372, 219, 157, 156]",,25,0.5887096774193549,0.7168949771689498,0.9936305732484076,4,0.011135029926223663,120,4,sgd,huber,120,recon,,,,,0.8424706727707044,True,,,,,,,1e-10,PRUNED
77,0.9001925307795221,gelu,128,0.26353584051805284,3,8.0,0.010256823339001034,870,2.0,20,0.5483659328693519,0.6840056629865667,,3,0.01777004348962505,3,mse,recon,0.8870448023153222,True,1e-06,,,,,gelu,128,0.26353584051805284,3,8.0,8.0,-8.0,0.010256823339001034,8,362,3,870,2.0,"[870, 477, 326]",,20,0.5482758620689655,0.6834381551362684,,3,0.01777004348962505,120,3,sgd,mse,120,recon,,,,,0.8870448023153222,True,,,,,,,1e-06,PRUNED
78,0.8863170782363423,gelu,128,0.20321707875688785,7,8.0,0.06503933717104608,990,2.0,32,0.6092149704652603,0.7138428159408465,,2,0.015371077256690938,3,mse,recon,0.7486076952738293,True,1e-10,,,,,gelu,128,0.20321707875688785,7,8.0,8.0,-8.0,0.06503933717104608,8,242,2,990,2.0,"[990, 603, 430]",,32,0.6090909090909091,0.7131011608623549,,2,0.015371077256690938,120,3,sgd,mse,120,recon,,,,,0.7486076952738293,True,,,,,,,1e-10,PRUNED
79,0.8804102313332994,gelu,128,0.5317121623816355,6,8.0,0.08892260431383962,931,2.0,38,0.5222899775526241,0.565671869638702,,4,0.013683335176982923,3,mse,recon,0.8533805427602942,True,1e-10,,,,,gelu,128,0.5317121623816355,6,8.0,8.0,-8.0,0.08892260431383962,8,483,4,931,2.0,"[931, 486, 274]",,38,0.5220193340494093,0.5637860082304527,,4,0.013683335176982923,120,3,sgd,mse,120,recon,,,,,0.8533805427602942,True,,,,,,,1e-10,PRUNED
