number,value,params_activation,params_batch_size,params_beta,params_beta_warmup_rounds,params_clip_abs,params_dropout,params_first_layer,params_grad_clip,params_latent_dim,params_layer_1_dropoff,params_layer_2_dropoff,params_layer_3_dropoff,params_local_epochs,params_lr,params_n_layers,params_recon_type,params_score_type,params_sgd_momentum,params_sgd_nesterov,params_weight_decay,user_attrs_NF-CICIDS2018-v3__test_auroc,user_attrs_NF-CICIDS2018-v3__val_auroc,user_attrs_NF-ToN-IoT-v3__test_auroc,user_attrs_NF-ToN-IoT-v3__val_auroc,user_attrs_activation,user_attrs_batch_size,user_attrs_beta,user_attrs_beta_warmup_rounds,user_attrs_clip_abs,user_attrs_clip_max,user_attrs_clip_min,user_attrs_dropout,user_attrs_early_stop_patience,user_attrs_epochs_matched,user_attrs_epochs_per_round,user_attrs_first_layer,user_attrs_grad_clip,user_attrs_hidden_dims,user_attrs_hpo_seeds,user_attrs_latent_dim,user_attrs_layer_1_dropoff,user_attrs_layer_2_dropoff,user_attrs_layer_3_dropoff,user_attrs_local_epochs,user_attrs_lr,user_attrs_max_rounds,user_attrs_n_layers,user_attrs_optimizer,user_attrs_recon_type,user_attrs_rounds,user_attrs_score_type,user_attrs_seed_seen_obj_mean,user_attrs_seed_seen_obj_std,user_attrs_seen_test_mean,user_attrs_seen_test_min,user_attrs_sgd_momentum,user_attrs_sgd_nesterov,user_attrs_train__best_metric,user_attrs_train__history_len,user_attrs_unseen__test_auroc,user_attrs_unseen__val_auroc,user_attrs_unseen_test_n,user_attrs_unseen_val_n,user_attrs_weight_decay,state
74,0.7629375250498174,leakyrelu,128,0.17335805257412465,4,5.0,0.36685042490785486,350,5.0,36,0.9089036405424685,,,7,0.0003354366299869761,2,mse,recon,0.4024772099341806,True,1e-05,,,,,leakyrelu,128,0.17335805257412465,4,5.0,5.0,-5.0,0.36685042490785486,8,845,7,350,5.0,"[350, 318]",,36,0.9085714285714286,,,7,0.0003354366299869761,120,2,sgd,mse,120,recon,,,,,0.4024772099341806,True,,,,,,,1e-05,PRUNED
75,0.8062598905616992,leakyrelu,128,0.18682732664388152,3,5.0,0.3428132345878471,175,,45,0.846468602776979,,,8,0.01265883784837381,2,mse,recon,0.2933757805254477,True,1e-05,,,,,leakyrelu,128,0.18682732664388152,3,5.0,5.0,-5.0,0.3428132345878471,8,966,8,175,,"[175, 148]",,45,0.8457142857142858,,,8,0.01265883784837381,120,2,sgd,mse,120,recon,,,,,0.2933757805254477,True,,,,,,,1e-05,PRUNED
76,0.7435413808870599,gelu,128,0.1512131131616891,4,8.0,0.3008991340366926,254,5.0,35,0.8703409423075414,,,7,0.007064223724502808,2,huber,recon,0.48537712943111233,True,1e-05,,,,,gelu,128,0.1512131131616891,4,8.0,8.0,-8.0,0.3008991340366926,8,845,7,254,5.0,"[254, 221]",,35,0.8700787401574803,,,7,0.007064223724502808,120,2,sgd,huber,120,recon,,,,,0.48537712943111233,True,,,,,,,1e-05,PRUNED
77,0.8178459309217769,leakyrelu,128,0.2059824604990098,3,6.0,0.38736080934224515,206,5.0,40,0.8903693094898365,,,8,0.010973908619664354,2,mse,recon,0.3423048703026033,False,0.0,,,,,leakyrelu,128,0.2059824604990098,3,6.0,6.0,-6.0,0.38736080934224515,8,966,8,206,5.0,"[206, 183]",,40,0.8883495145631068,,,8,0.010973908619664354,120,2,sgd,mse,120,recon,,,,,0.3423048703026033,False,,,,,,,0.0,PRUNED
78,0.852422389373891,leakyrelu,128,0.13407391622705758,5,5.0,0.39780804378322593,366,5.0,31,,,,7,0.014056647884222806,1,mse,recon,0.38496357065496234,True,0.0001,0.8756988734403255,0.8756430188158235,0.8427285531225479,0.8292017599319587,leakyrelu,128,0.13407391622705758,5,5.0,5.0,-5.0,0.39780804378322593,8,845,7,366,5.0,[366],"[42, 43, 44, 45]",31,,,,7,0.014056647884222806,120,1,sgd,mse,120,recon,0.852422389373891,0.005211127204163544,0.8592137132814367,0.8427285531225479,0.38496357065496234,True,0.8531997716468056,9.75,0.3886717904715669,0.3923538196149714,7290.0,5832.0,0.0001,COMPLETE
79,0.8182940345212357,leakyrelu,128,0.19478795775643587,2,5.0,0.3335686714269737,83,5.0,54,0.8275273795802759,,,8,0.018508402987684348,2,mse,recon,0.49761351181364366,True,1e-05,,,,,leakyrelu,128,0.19478795775643587,2,5.0,5.0,-5.0,0.3335686714269737,8,966,8,83,5.0,"[83, 68]",,54,0.8192771084337349,,,8,0.018508402987684348,120,2,sgd,mse,120,recon,,,,,0.49761351181364366,True,,,,,,,1e-05,PRUNED
