number,value,params_activation,params_batch_size,params_beta,params_beta_warmup_rounds,params_clip_abs,params_dropout,params_first_layer,params_grad_clip,params_latent_dim,params_layer_1_dropoff,params_layer_2_dropoff,params_layer_3_dropoff,params_local_epochs,params_lr,params_n_layers,params_recon_type,params_score_type,params_sgd_momentum,params_sgd_nesterov,params_weight_decay,user_attrs_NF-BoT-IoT-v3__test_auroc,user_attrs_NF-BoT-IoT-v3__val_auroc,user_attrs_NF-ToN-IoT-v3__test_auroc,user_attrs_NF-ToN-IoT-v3__val_auroc,user_attrs_activation,user_attrs_batch_size,user_attrs_beta,user_attrs_beta_warmup_rounds,user_attrs_clip_abs,user_attrs_clip_max,user_attrs_clip_min,user_attrs_dropout,user_attrs_early_stop_patience,user_attrs_epochs_matched,user_attrs_epochs_per_round,user_attrs_first_layer,user_attrs_grad_clip,user_attrs_hidden_dims,user_attrs_hpo_seeds,user_attrs_latent_dim,user_attrs_layer_1_dropoff,user_attrs_layer_2_dropoff,user_attrs_layer_3_dropoff,user_attrs_local_epochs,user_attrs_lr,user_attrs_max_rounds,user_attrs_n_layers,user_attrs_optimizer,user_attrs_recon_type,user_attrs_rounds,user_attrs_score_type,user_attrs_seed_seen_obj_mean,user_attrs_seed_seen_obj_std,user_attrs_seen_test_mean,user_attrs_seen_test_min,user_attrs_sgd_momentum,user_attrs_sgd_nesterov,user_attrs_train__best_metric,user_attrs_train__history_len,user_attrs_unseen__test_auroc,user_attrs_unseen__val_auroc,user_attrs_unseen_test_n,user_attrs_unseen_val_n,user_attrs_weight_decay,state
74,0.9238692094936221,elu,64,0.46347333236303745,5,8.0,0.00378917806364025,726,1.0,38,0.5970726093727375,0.803004134011988,0.6827188985827731,7,0.012688973917440682,4,mse,recon,0.872791077910549,False,1e-06,0.977342865906093,0.9776574151693227,0.8766907144913547,0.8700810038179215,elu,64,0.46347333236303745,5,8.0,8.0,-8.0,0.00378917806364025,8,843,7,726,1.0,"[726, 433, 347, 236]","[42, 43, 44, 45]",38,0.5964187327823691,0.8013856812933026,0.6801152737752162,7,0.012688973917440682,120,4,sgd,mse,120,recon,0.9238692094936221,0.002001492359373786,0.9270167901987239,0.8766907144913547,0.872791077910549,False,0.9259686017591793,26.5,0.5742543574921769,0.5822141915800625,7290.0,5832.0,1e-06,COMPLETE
75,0.8160885627473229,elu,64,0.4509523956025956,4,8.0,0.049719274292419735,697,1.0,37,0.5927111900594919,0.786497571973367,0.713548876365265,1,0.001152763834604923,4,mse,recon,0.7760148760388608,False,1e-06,,,,,elu,64,0.4509523956025956,4,8.0,8.0,-8.0,0.049719274292419735,8,121,1,697,1.0,"[697, 413, 324, 231]",,37,0.5925394548063128,0.784503631961259,0.7129629629629629,1,0.001152763834604923,120,4,sgd,mse,120,recon,,,,,0.7760148760388608,False,,,,,,,1e-06,PRUNED
76,0.8869527026518466,elu,64,0.5661581578782154,5,8.0,0.02065364785838449,750,1.0,33,0.547329663167039,0.7249335647398919,0.5754381730119925,7,0.009425028484942763,4,huber,recon,0.9105493823213843,False,1e-06,,,,,elu,64,0.5661581578782154,5,8.0,8.0,-8.0,0.02065364785838449,8,843,7,750,1.0,"[750, 410, 297, 170]",,33,0.5466666666666666,0.724390243902439,0.5723905723905723,7,0.009425028484942763,120,4,sgd,huber,120,recon,,,,,0.9105493823213843,False,,,,,,,1e-06,PRUNED
77,0.751154143874861,elu,64,0.49200334584793903,2,8.0,0.038788733169794615,603,1.0,41,0.7015098078641921,0.8952208913808709,0.6777887561194874,2,0.00030304685838704646,4,mse,recon,0.6427037175389185,False,1e-06,,,,,elu,64,0.49200334584793903,2,8.0,8.0,-8.0,0.038788733169794615,8,241,2,603,1.0,"[603, 423, 378, 256]",,41,0.7014925373134329,0.8936170212765957,0.6772486772486772,2,0.00030304685838704646,120,4,sgd,mse,120,recon,,,,,0.6427037175389185,False,,,,,,,1e-06,PRUNED
78,0.9223786498054347,elu,64,0.41350643510703783,5,8.0,0.00013460700601855558,559,1.0,54,0.610057664370648,0.8033115896805231,0.7682535713292906,8,0.016775444934391818,4,mse,recon,0.8551372871181732,False,1e-06,0.9691370631923393,0.9697968148157556,0.8810022561300314,0.8749604847951138,elu,64,0.41350643510703783,5,8.0,8.0,-8.0,0.00013460700601855558,8,963,8,559,1.0,"[559, 341, 273, 209]","[42, 43, 44, 45]",54,0.6100178890876565,0.8005865102639296,0.7655677655677655,8,0.016775444934391818,120,4,sgd,mse,120,recon,0.9223786498054347,0.0036827954973686528,0.9250696596611854,0.8810022561300314,0.8551372871181732,False,0.9236323975756481,26.0,0.575969317384244,0.5838909416802618,7290.0,5832.0,1e-06,COMPLETE
79,0.9279702571052102,elu,64,0.371900125108943,3,8.0,0.058368768510686175,506,5.0,56,0.5691362160605736,0.8143851738374538,0.8029534518495324,8,0.010503290932017958,4,mse,recon,0.882934154421437,False,1e-06,0.9776149375001176,0.9771741183405119,0.8842079365348176,0.8787663958699085,elu,64,0.371900125108943,3,8.0,8.0,-8.0,0.058368768510686175,8,963,8,506,5.0,"[506, 287, 233, 187]","[42, 43, 44, 45]",56,0.567193675889328,0.8118466898954704,0.8025751072961373,8,0.010503290932017958,120,4,sgd,mse,120,recon,0.9279702571052102,0.002054666159514246,0.9309114370174676,0.8842079365348176,0.882934154421437,False,0.9284367879030786,23.75,0.586007995243122,0.5905366846931267,7290.0,5832.0,1e-06,COMPLETE
